[
  {
    "id": 1,
    "slug": "pre-amble",
    "Hand-Off Story Arc": "Pre-amble",
    "Component": "Project goals",
    "Description": "The goals the phase was working toward",
    "Format of the Resulting Section": "List of items",
    "Is this in the Client Hand-Off?": "No",
    "Is this in the Teammate Hand-off?": "Yes",
    "Is this in the Teammate Case Study?": "Yes",
    "Is this in the Tech Fleet Org Case Study?": "Yes",
    "From Which Deliverable Does This Information Come?": [
      {
        "slug": "project-plan",
        "label": "Project Plan"
      },
      {
        "slug": "project-goals-definition",
        "label": "Project Goals Definition"
      }
    ],
    "Workshop Associated with the Deliverables": [
      {
        "slug": "project-plan-workshop-template",
        "label": "Project Plan Workshop Template"
      }
    ],
    "Unique ID": 1
  },
  {
    "id": 2,
    "slug": "pre-amble-2",
    "Hand-Off Story Arc": "Pre-amble",
    "Component": "Recap summary of the deliverables for the project phase",
    "Description": "Plain-language recap of what this phase set out to deliver",
    "Format of the Resulting Section": "List of items",
    "Is this in the Client Hand-Off?": "Yes",
    "Is this in the Teammate Hand-off?": "Yes",
    "Is this in the Teammate Case Study?": "Yes",
    "Is this in the Tech Fleet Org Case Study?": "Yes",
    "From Which Deliverable Does This Information Come?": [
      {
        "slug": "project-plan",
        "label": "Project Plan"
      },
      {
        "slug": "project-goals-definition",
        "label": "Project Goals Definition"
      }
    ],
    "Workshop Associated with the Deliverables": [
      {
        "slug": "project-plan-workshop-template",
        "label": "Project Plan Workshop Template"
      }
    ],
    "Unique ID": 2
  },
  {
    "id": 3,
    "slug": "pre-amble-3",
    "Hand-Off Story Arc": "Pre-amble",
    "Component": "Recap of cross-functional team hats that were involved",
    "Description": "The different duties that were performed on the cross-functional team",
    "Format of the Resulting Section": "Liste of items",
    "Is this in the Client Hand-Off?": "No",
    "Is this in the Teammate Hand-off?": "Yes",
    "Is this in the Teammate Case Study?": "Yes",
    "Is this in the Tech Fleet Org Case Study?": "Yes",
    "From Which Deliverable Does This Information Come?": [
      {
        "slug": "raci-charts",
        "label": "RACI Charts"
      }
    ],
    "Workshop Associated with the Deliverables": [
      {
        "slug": "raci-hats-workshop-template",
        "label": "RACI Hats Workshop Template"
      }
    ],
    "Unique ID": 3
  },
  {
    "id": 4,
    "slug": "pre-amble-4",
    "Hand-Off Story Arc": "Pre-amble",
    "Component": "Summarized reflections on what the team learned in hindsight",
    "Description": "Team's top takeaways summarized for the pre-amble",
    "Format of the Resulting Section": "Paragraph",
    "Is this in the Client Hand-Off?": "No",
    "Is this in the Teammate Hand-off?": "Yes",
    "Is this in the Teammate Case Study?": "Yes",
    "Is this in the Tech Fleet Org Case Study?": "No",
    "Unique ID": 4
  },
  {
    "id": 5,
    "slug": "pre-amble-5",
    "Hand-Off Story Arc": "Pre-amble",
    "Component": "Previous work the team did before this phase",
    "Description": "Context on prior phases so readers know the starting point",
    "Format of the Resulting Section": "Paragraph",
    "Is this in the Client Hand-Off?": "Yes",
    "Is this in the Teammate Hand-off?": "No",
    "Is this in the Teammate Case Study?": "Yes",
    "Is this in the Tech Fleet Org Case Study?": "No",
    "From Which Deliverable Does This Information Come?": [
      {
        "slug": "statement-of-work",
        "label": "Statement of Work"
      }
    ],
    "Workshop Associated with the Deliverables": [
      {
        "slug": "client-kickoff-workshop-template",
        "label": "Client Kickoff Workshop Template"
      }
    ],
    "Unique ID": 5
  },
  {
    "id": 6,
    "slug": "pre-amble-6",
    "Hand-Off Story Arc": "Pre-amble",
    "Component": "Glossaries of terms that the team had to learn related to the project",
    "Description": "Domain and project terms defined for newcomers",
    "Format of the Resulting Section": "List of items",
    "Is this in the Client Hand-Off?": "No",
    "Is this in the Teammate Hand-off?": "Yes",
    "Is this in the Teammate Case Study?": "No",
    "Is this in the Tech Fleet Org Case Study?": "No",
    "Unique ID": 6
  },
  {
    "id": 7,
    "slug": "pre-amble-7",
    "Hand-Off Story Arc": "Pre-amble",
    "Component": "Project operations details",
    "Description": "How the team ran the project (process and cadence)",
    "Format of the Resulting Section": "Paragraph",
    "Is this in the Client Hand-Off?": "No",
    "Is this in the Teammate Hand-off?": "Yes",
    "Is this in the Teammate Case Study?": "Yes",
    "Is this in the Tech Fleet Org Case Study?": "Yes",
    "From Which Deliverable Does This Information Come?": [
      {
        "slug": "team-process-map",
        "label": "Team Process Map"
      }
    ],
    "Workshop Associated with the Deliverables": [
      {
        "slug": "team-process-mapping-workshop-template",
        "label": "Team Process Mapping Workshop Template"
      }
    ],
    "Unique ID": 7
  },
  {
    "id": 8,
    "slug": "pre-amble-8",
    "Hand-Off Story Arc": "Pre-amble",
    "Component": "Summary of the client",
    "Description": "Who the client is and what they need",
    "Format of the Resulting Section": "Paragraph",
    "Is this in the Client Hand-Off?": "No",
    "Is this in the Teammate Hand-off?": "Yes",
    "Is this in the Teammate Case Study?": "Yes",
    "Is this in the Tech Fleet Org Case Study?": "Yes",
    "From Which Deliverable Does This Information Come?": [
      {
        "slug": "statement-of-work",
        "label": "Statement of Work"
      }
    ],
    "Workshop Associated with the Deliverables": [
      {
        "slug": "client-kickoff-workshop-template",
        "label": "Client Kickoff Workshop Template"
      }
    ],
    "Unique ID": 8
  },
  {
    "id": 9,
    "slug": "part-1-empathy-building",
    "Hand-Off Story Arc": "Part 1: Empathy Building",
    "Component": "The problems in the current state of the world that were prioritized",
    "Description": "The prioritized problem statements the team worked against",
    "Format of the Resulting Section": "Paragraph",
    "Is this in the Client Hand-Off?": "Yes",
    "Is this in the Teammate Hand-off?": "Yes",
    "Is this in the Teammate Case Study?": "Yes",
    "Is this in the Tech Fleet Org Case Study?": "Yes",
    "From Which Deliverable Does This Information Come?": [
      {
        "slug": "problem-statements",
        "label": "Problem Statements"
      },
      {
        "slug": "problem-checklists",
        "label": "Problem Checklists"
      },
      {
        "slug": "user-story-statements",
        "label": "User Story Statements"
      }
    ],
    "Workshop Associated with the Deliverables": [
      {
        "slug": "scenario-based-problem-statement-generation-workshop-template",
        "label": "Scenario-Based Problem Statement Generation Workshop Template"
      }
    ],
    "Unique ID": 9
  },
  {
    "id": 10,
    "slug": "part-1-empathy-building-2",
    "Hand-Off Story Arc": "Part 1: Empathy Building",
    "Component": "UX Research work and insights we learned",
    "Description": "Research performed and the insights it produced",
    "Format of the Resulting Section": "Paragraph",
    "Is this in the Client Hand-Off?": "Yes",
    "Is this in the Teammate Hand-off?": "Yes",
    "Is this in the Teammate Case Study?": "Yes",
    "Is this in the Tech Fleet Org Case Study?": "Yes",
    "From Which Deliverable Does This Information Come?": [
      {
        "slug": "research-report",
        "label": "Research Report"
      },
      {
        "slug": "rainbow-table",
        "label": "Rainbow Table"
      },
      {
        "slug": "affinity-map",
        "label": "Affinity Map"
      },
      {
        "slug": "research-plan",
        "label": "Research Plan"
      },
      {
        "slug": "research-analysis",
        "label": "Research Analysis"
      }
    ],
    "Workshop Associated with the Deliverables": [
      {
        "slug": "research-plan-workshop-template",
        "label": "Research Plan Workshop Template"
      },
      {
        "slug": "ux-research-analysis-workshop-template",
        "label": "UX Research Analysis Workshop Template"
      },
      {
        "slug": "research-analysis-presentation-slide-template",
        "label": "Research Analysis Presentation Slide Template"
      }
    ],
    "Unique ID": 10
  },
  {
    "id": 11,
    "slug": "part-2-the-journey",
    "Hand-Off Story Arc": "Part 2: The Journey",
    "Component": "Key performance indicators",
    "Description": "The KPIs used to measure success and results against them",
    "Format of the Resulting Section": "List of items",
    "Is this in the Client Hand-Off?": "Yes",
    "Is this in the Teammate Hand-off?": "Yes",
    "Is this in the Teammate Case Study?": "Yes",
    "Is this in the Tech Fleet Org Case Study?": "Yes",
    "From Which Deliverable Does This Information Come?": [
      {
        "slug": "key-performance-indicators-kpis",
        "label": "Key Performance Indicators (KPI's)"
      }
    ],
    "Workshop Associated with the Deliverables": [
      {
        "slug": "kpi-success-measurements-definition-workshop-template",
        "label": "KPI Success Measurements Definition Workshop Template"
      }
    ],
    "Unique ID": 11
  },
  {
    "id": 12,
    "slug": "part-2-the-journey-2",
    "Hand-Off Story Arc": "Part 2: The Journey",
    "Component": "Product team strategy / vision / scope work",
    "Description": "Where the product is going and what was in/out of scope",
    "Format of the Resulting Section": "Table",